Question,Generation number,Answer,Steps,Merged buckets,Best matches tuple
"["" For a New Year's resolution, Andy wants to lose 30 lbs. by his birthday, which is July 19th. Today is December 31st. If Andy needs to burn 3500 calories to lose a pound, how much of a calorie deficit (net amount of calories burned vs. calories consumed) does he need each day to reach his goal?""]",0,"First, we need to figure out how many days are between December 31st and July 19th. 

To do this, we can subtract December 31st from July 19th: 

79 - 31 = 48 days 

So Andy has 48 days to lose 30 lbs. 

Next, we need to find out how many calories Andy needs to burn in total to lose those 30 lbs. 

We know that he needs to burn 3500 calories per pound, so: 

30 lbs * 3500 calories/lb = 105,000 calories 

Now, we need to find out how many calories Andy needs to consume each day to reach his goal. 

We'll divide the total number of calories he needs to burn (105,000) by the number of days he has (48): 

105,000 calories / 48 days = 2187.5 calories/day 

However, this number is not realistic since Andy can't eat a fraction of a calorie. 

So we'll round up to the nearest whole number, which is 2188 calories/day. 

Finally, we'll subtract the number of calories Andy needs to consume each day (2188) from the number of calories he burns each day (which we'll assume is 2000 for now) to find his calorie deficit: 

2000 - 2188 = -188 

Andy needs a calorie deficit of -188 each day to reach his goal of losing 30 lbs. by his birthday.","['First, we need to figure out how many days are between December 31st and July 19th. \n\nTo do this, we can subtract December 31st from July 19th: \n\n79 - 31 = 48 days \n\nSo Andy has 48 days to lose 30 lbs. ', ' Next, we need to find out how many calories Andy needs to burn in total to lose those 30 lbs. \n\nWe know that he needs to burn 3500 calories per pound, so: \n\n30 lbs * 3500 calories/lb = 105,000 calories ', "" Now, we need to find out how many calories Andy needs to consume each day to reach his goal. \n\nWe'll divide the total number of calories he needs to burn (105,000) by the number of days he has (48): \n\n105,000 calories / 48 days = 2187.5 calories/day \n\nHowever, this number is not realistic since Andy can't eat a fraction of a calorie. \n\nSo we'll round up to the nearest whole number, which is 2188 calories/day. "", "" Finally, we'll subtract the number of calories Andy needs to consume each day (2188) from the number of calories he burns each day (which we'll assume is 2000 for now) to find his calorie deficit: \n\n2000 - 2188 = -188 \n\nAndy needs a calorie deficit of -188 each day to reach his goal of losing 30 lbs. by his birthday.""]","[('First, we need to figure out how many days are between December 31st and July 19th. \n\nTo do this, we can subtract December 31st from July 19th: \n\n79 - 31 = 48 days \n\nSo Andy has 48 days to lose 30 lbs. ', '""Determining the Number of Days for Weight Loss Goal""'), (' Next, we need to find out how many calories Andy needs to burn in total to lose those 30 lbs. \n\nWe know that he needs to burn 3500 calories per pound, so: \n\n30 lbs * 3500 calories/lb = 105,000 calories ', '""Calculating Total Calories Needed to Lose 30 lbs""'), ("" Now, we need to find out how many calories Andy needs to consume each day to reach his goal. \n\nWe'll divide the total number of calories he needs to burn (105,000) by the number of days he has (48): \n\n105,000 calories / 48 days = 2187.5 calories/day \n\nHowever, this number is not realistic since Andy can't eat a fraction of a calorie. \n\nSo we'll round up to the nearest whole number, which is 2188 calories/day. "", '""Calculating Daily Calorie Consumption Requirement and Rounding to the Nearest Whole Number""'), ("" Finally, we'll subtract the number of calories Andy needs to consume each day (2188) from the number of calories he burns each day (which we'll assume is 2000 for now) to find his calorie deficit: \n\n2000 - 2188 = -188 \n\nAndy needs a calorie deficit of -188 each day to reach his goal of losing 30 lbs. by his birthday."", '""Calculating Daily Calorie Deficit""')]","[('First, we need to figure out how many days are between December 31st and July 19th. \n\nTo do this, we can subtract December 31st from July 19th: \n\n79 - 31 = 48 days \n\nSo Andy has 48 days to lose 30 lbs. ', 104, 184, 1.0), (' Next, we need to find out how many calories Andy needs to burn in total to lose those 30 lbs. \n\nWe know that he needs to burn 3500 calories per pound, so: \n\n30 lbs * 3500 calories/lb = 105,000 calories ', 185, 259, 0.9950738916256158), ("" Now, we need to find out how many calories Andy needs to consume each day to reach his goal. \n\nWe'll divide the total number of calories he needs to burn (105,000) by the number of days he has (48): \n\n105,000 calories / 48 days = 2187.5 calories/day \n\nHowever, this number is not realistic since Andy can't eat a fraction of a calorie. \n\nSo we'll round up to the nearest whole number, which is 2188 calories/day. "", 260, 395, 0.9975845410628019), ("" Finally, we'll subtract the number of calories Andy needs to consume each day (2188) from the number of calories he burns each day (which we'll assume is 2000 for now) to find his calorie deficit: \n\n2000 - 2188 = -188 \n\nAndy needs a calorie deficit of -188 each day to reach his goal of losing 30 lbs. by his birthday."", 397, 506, 0.9984301412872841)]"
"["" For a New Year's resolution, Andy wants to lose 30 lbs. by his birthday, which is July 19th. Today is December 31st. If Andy needs to burn 3500 calories to lose a pound, how much of a calorie deficit (net amount of calories burned vs. calories consumed) does he need each day to reach his goal?""]",1,"First, we need to determine how many days are between December 31st and July 19th. To do this, we can use the date calculator on our phone or computer, or simply count the number of days on a calendar. 

The number of days between December 31st and July 19th is: 

191 days 

Next, we need to determine how many calories Andy needs to burn in order to lose 30 pounds. We know that he needs to burn 3500 calories to lose one pound, so to lose 30 pounds, he needs to burn: 

30 x 3500 calories = 105,000 calories 

Now, we can calculate the calorie deficit Andy needs each day to reach his goal. To do this, we divide the total number of calories he needs to burn by the number of days between now and his birthday: 

105,000 calories / 191 days = 555.56 calories per day 

So, Andy needs to burn a net amount of 555.56 calories each day to reach his goal of losing 30 pounds by his birthday.","['First, we need to determine how many days are between December 31st and July 19th. To do this, we can use the date calculator on our phone or computer, or simply count the number of days on a calendar. \n\nThe number of days between December 31st and July 19th is: \n\n191 days ', ' Next, we need to determine how many calories Andy needs to burn in order to lose 30 pounds. We know that he needs to burn 3500 calories to lose one pound, so to lose 30 pounds, he needs to burn: \n\n30 x 3500 calories = 105,000 calories ', ' Now, we can calculate the calorie deficit Andy needs each day to reach his goal. To do this, we divide the total number of calories he needs to burn by the number of days between now and his birthday: \n\n105,000 calories / 191 days = 555.56 calories per day \n\nSo, Andy needs to burn a net amount of 555.56 calories each day to reach his goal of losing 30 pounds by his birthday.']","[('First, we need to determine how many days are between December 31st and July 19th. To do this, we can use the date calculator on our phone or computer, or simply count the number of days on a calendar. \n\nThe number of days between December 31st and July 19th is: \n\n191 days ', '""Determining the Number of Days for Weight Loss Goal""'), (' Next, we need to determine how many calories Andy needs to burn in order to lose 30 pounds. We know that he needs to burn 3500 calories to lose one pound, so to lose 30 pounds, he needs to burn: \n\n30 x 3500 calories = 105,000 calories ', '""Calculating Total Calories Needed to Lose 30 lbs""'), (' Now, we can calculate the calorie deficit Andy needs each day to reach his goal. To do this, we divide the total number of calories he needs to burn by the number of days between now and his birthday: \n\n105,000 calories / 191 days = 555.56 calories per day \n\nSo, Andy needs to burn a net amount of 555.56 calories each day to reach his goal of losing 30 pounds by his birthday.', '""Calculating Daily Calorie Consumption Requirement and Rounding to the Nearest Whole Number""')]","[('First, we need to determine how many days are between December 31st and July 19th. To do this, we can use the date calculator on our phone or computer, or simply count the number of days on a calendar. \n\nThe number of days between December 31st and July 19th is: \n\n191 days ', 104, 184, 1.0), (' Next, we need to determine how many calories Andy needs to burn in order to lose 30 pounds. We know that he needs to burn 3500 calories to lose one pound, so to lose 30 pounds, he needs to burn: \n\n30 x 3500 calories = 105,000 calories ', 185, 262, 0.9957627118644068), (' Now, we can calculate the calorie deficit Andy needs each day to reach his goal. To do this, we divide the total number of calories he needs to burn by the number of days between now and his birthday: \n\n105,000 calories / 191 days = 555.56 calories per day \n\nSo, Andy needs to burn a net amount of 555.56 calories each day to reach his goal of losing 30 pounds by his birthday.', 263, 374, 0.9973544973544973)]"
"["" For a New Year's resolution, Andy wants to lose 30 lbs. by his birthday, which is July 19th. Today is December 31st. If Andy needs to burn 3500 calories to lose a pound, how much of a calorie deficit (net amount of calories burned vs. calories consumed) does he need each day to reach his goal?""]",2,"First, we need to find out how many days are between December 31st and July 19th. 

We can use the following formula to calculate the number of days:

(End Date - Start Date) / Days per Year + 1

(July 19th - December 31st) / 365 + 1 = 136 days

So, Andy has 136 days to reach his goal.

Next, we need to determine how many calories Andy needs to consume in those 136 days to gain or maintain his current weight. Let's assume that his current weight is 200 lbs.

To maintain his weight, Andy would need to consume approximately 2000 calories per day (based on his weight and activity level).

However, since Andy wants to lose 30 lbs., we'll calculate the daily caloric intake required to lose weight:

Caloric Intake for Weight Loss = Daily Caloric Intake for Maintenance - Calories Burned per Pound

Caloric Intake for Weight Loss = 2000 calories - (3500 calories/pound × 30 pounds)

Caloric Intake for Weight Loss = 2000 calories - 105,000 calories

Caloric Intake for Weight Loss = 104,000 calories

Now, let's calculate the daily calorie deficit needed to lose 30 lbs.:

Daily Calorie Deficit = (Caloric Intake for Weight Loss - Daily Caloric Intake for Maintenance) / Days

Daily Calorie Deficit = (104,000 calories - 2000 calories) / 136 days

Daily Calorie Deficit ≈ 782 calories

So, Andy needs to create a calorie deficit of approximately 782 calories each day to reach his goal of losing 30 lbs. by his birthday.","['First, we need to find out how many days are between December 31st and July 19th. \n\nWe can use the following formula to calculate the number of days:\n\n(End Date - Start Date) / Days per Year + 1\n\n(July 19th - December 31st) / 365 + 1 = 136 days\n\nSo, Andy has 136 days to reach his goal. ', "" Next, we need to determine how many calories Andy needs to consume in those 136 days to gain or maintain his current weight. Let's assume that his current weight is 200 lbs.\n\nTo maintain his weight, Andy would need to consume approximately 2000 calories per day (based on his weight and activity level).\n\nHowever, since Andy wants to lose 30 lbs., we'll calculate the daily caloric intake required to lose weight:\n\nCaloric Intake for Weight Loss = Daily Caloric Intake for Maintenance - Calories Burned per Pound\n\nCaloric Intake for Weight Loss = 2000 calories - (3500 calories/pound × 30 pounds)\n\nCaloric Intake for Weight Loss = 2000 calories - 105,000 calories\n\nCaloric Intake for Weight Loss = 104,000 calories "", "" Now, let's calculate the daily calorie deficit needed to lose 30 lbs.:\n\nDaily Calorie Deficit = (Caloric Intake for Weight Loss - Daily Caloric Intake for Maintenance) / Days\n\nDaily Calorie Deficit = (104,000 calories - 2000 calories) / 136 days\n\nDaily Calorie Deficit ≈ 782 calories\n\nSo, Andy needs to create a calorie deficit of approximately 782 calories each day to reach his goal of losing 30 lbs. by his birthday.""]","[('First, we need to find out how many days are between December 31st and July 19th. \n\nWe can use the following formula to calculate the number of days:\n\n(End Date - Start Date) / Days per Year + 1\n\n(July 19th - December 31st) / 365 + 1 = 136 days\n\nSo, Andy has 136 days to reach his goal. ', '""Determining the Number of Days for Weight Loss Goal""'), ("" Next, we need to determine how many calories Andy needs to consume in those 136 days to gain or maintain his current weight. Let's assume that his current weight is 200 lbs.\n\nTo maintain his weight, Andy would need to consume approximately 2000 calories per day (based on his weight and activity level).\n\nHowever, since Andy wants to lose 30 lbs., we'll calculate the daily caloric intake required to lose weight:\n\nCaloric Intake for Weight Loss = Daily Caloric Intake for Maintenance - Calories Burned per Pound\n\nCaloric Intake for Weight Loss = 2000 calories - (3500 calories/pound × 30 pounds)\n\nCaloric Intake for Weight Loss = 2000 calories - 105,000 calories\n\nCaloric Intake for Weight Loss = 104,000 calories "", '""Calculating Daily Calorie Consumption Requirement and Rounding to the Nearest Whole Number""'), ("" Now, let's calculate the daily calorie deficit needed to lose 30 lbs.:\n\nDaily Calorie Deficit = (Caloric Intake for Weight Loss - Daily Caloric Intake for Maintenance) / Days\n\nDaily Calorie Deficit = (104,000 calories - 2000 calories) / 136 days\n\nDaily Calorie Deficit ≈ 782 calories\n\nSo, Andy needs to create a calorie deficit of approximately 782 calories each day to reach his goal of losing 30 lbs. by his birthday."", '""Calculating Daily Calorie Consumption Requirement and Rounding to the Nearest Whole Number""')]","[('First, we need to find out how many days are between December 31st and July 19th. \n\nWe can use the following formula to calculate the number of days:\n\n(End Date - Start Date) / Days per Year + 1\n\n(July 19th - December 31st) / 365 + 1 = 136 days\n\nSo, Andy has 136 days to reach his goal. ', 104, 207, 0.9965156794425087), ("" Next, we need to determine how many calories Andy needs to consume in those 136 days to gain or maintain his current weight. Let's assume that his current weight is 200 lbs.\n\nTo maintain his weight, Andy would need to consume approximately 2000 calories per day (based on his weight and activity level).\n\nHowever, since Andy wants to lose 30 lbs., we'll calculate the daily caloric intake required to lose weight:\n\nCaloric Intake for Weight Loss = Daily Caloric Intake for Maintenance - Calories Burned per Pound\n\nCaloric Intake for Weight Loss = 2000 calories - (3500 calories/pound × 30 pounds)\n\nCaloric Intake for Weight Loss = 2000 calories - 105,000 calories\n\nCaloric Intake for Weight Loss = 104,000 calories "", 206, 415, 0.9972067039106145), ("" Now, let's calculate the daily calorie deficit needed to lose 30 lbs.:\n\nDaily Calorie Deficit = (Caloric Intake for Weight Loss - Daily Caloric Intake for Maintenance) / Days\n\nDaily Calorie Deficit = (104,000 calories - 2000 calories) / 136 days\n\nDaily Calorie Deficit ≈ 782 calories\n\nSo, Andy needs to create a calorie deficit of approximately 782 calories each day to reach his goal of losing 30 lbs. by his birthday."", 416, 552, 0.9976190476190476)]"
"["" For a New Year's resolution, Andy wants to lose 30 lbs. by his birthday, which is July 19th. Today is December 31st. If Andy needs to burn 3500 calories to lose a pound, how much of a calorie deficit (net amount of calories burned vs. calories consumed) does he need each day to reach his goal?""]",3,"Sure, let's break it down:

1. Andy wants to lose 30 lbs. by his birthday, which is 7 months away.
2. We know that 1 lb. = 3500 calories, so to lose 30 lbs., Andy needs to burn 3500 calories x 30 = 105,000 calories.
3. Today is December 31st, so there are 6 days left until Andy's birthday.
4. In 6 days, Andy needs to burn 105,000 calories to reach his goal.
5. Therefore, each day, Andy needs to burn 105,000 calories / 6 days = 17,500 calories.

So, Andy needs a calorie deficit of 17,500 calories each day to reach his goal.","[""Sure, let's break it down:\n\n1. Andy wants to lose 30 lbs. by his birthday, which is 7 months away. "", ' 2. We know that 1 lb. = 3500 calories, so to lose 30 lbs., Andy needs to burn 3500 calories x 30 = 105,000 calories. ', "" 3. Today is December 31st, so there are 6 days left until Andy's birthday. "", ' 4. In 6 days, Andy needs to burn 105,000 calories to reach his goal. ', ' 5. Therefore, each day, Andy needs to burn 105,000 calories / 6 days = 17,500 calories.\n\nSo, Andy needs a calorie deficit of 17,500 calories each day to reach his goal.']","[(""Sure, let's break it down:\n\n1. Andy wants to lose 30 lbs. by his birthday, which is 7 months away. "", '""Determining the time frame for weight loss goal""'), (' 2. We know that 1 lb. = 3500 calories, so to lose 30 lbs., Andy needs to burn 3500 calories x 30 = 105,000 calories. ', '""Calculating total calories needed to lose 30 lbs""'), ("" 3. Today is December 31st, so there are 6 days left until Andy's birthday. "", '""Calculating the number of days until Andy\'s birthday""'), (' 4. In 6 days, Andy needs to burn 105,000 calories to reach his goal. ', '""Calculating total calories needed to be burned within the given time frame""'), (' 5. Therefore, each day, Andy needs to burn 105,000 calories / 6 days = 17,500 calories.\n\nSo, Andy needs a calorie deficit of 17,500 calories each day to reach his goal.', '""Calculating Daily Calorie Deficit Needed to Reach Goal""')]","[(""Sure, let's break it down:\n\n1. Andy wants to lose 30 lbs. by his birthday, which is 7 months away. "", 104, 139, 0.98989898989899), (' 2. We know that 1 lb. = 3500 calories, so to lose 30 lbs., Andy needs to burn 3500 calories x 30 = 105,000 calories. ', 137, 190, 0.9830508474576272), ("" 3. Today is December 31st, so there are 6 days left until Andy's birthday. "", 189, 214, 0.9736842105263158), (' 4. In 6 days, Andy needs to burn 105,000 calories to reach his goal. ', 213, 240, 0.9714285714285714), (' 5. Therefore, each day, Andy needs to burn 105,000 calories / 6 days = 17,500 calories.\n\nSo, Andy needs a calorie deficit of 17,500 calories each day to reach his goal.', 240, 302, 0.9940828402366864)]"
"["" For a New Year's resolution, Andy wants to lose 30 lbs. by his birthday, which is July 19th. Today is December 31st. If Andy needs to burn 3500 calories to lose a pound, how much of a calorie deficit (net amount of calories burned vs. calories consumed) does he need each day to reach his goal?""]",4,"First, we need to calculate how many days are between December 31st and July 19th. 

To do this, subtract December 31st from July 19th: 

July 19th - December 31st = 221 days 

Next, we need to multiply the number of days by the number of calories Andy needs to burn per day to lose a pound: 

221 days x 3500 calories/day = 777,500 calories 

Finally, we need to subtract the total number of calories Andy has consumed during these 221 days from the total number of calories he needs to burn: 

777,500 calories - Total calories consumed = Calorie deficit 

To find out how much of a calorie deficit Andy needs each day, divide the total calorie deficit by the number of days: 

Calorie deficit / Number of days = Daily calorie deficit 

Daily calorie deficit = 777,500 calories / 221 days = 3,564 calories/day 

So, Andy needs to burn a net amount of 3,564 calories each day to reach his goal of losing 30 lbs. by his birthday.","['First, we need to calculate how many days are between December 31st and July 19th. \n\nTo do this, subtract December 31st from July 19th: \n\nJuly 19th - December 31st = 221 days ', ' Next, we need to multiply the number of days by the number of calories Andy needs to burn per day to lose a pound: \n\n221 days x 3500 calories/day = 777,500 calories ', ' Finally, we need to subtract the total number of calories Andy has consumed during these 221 days from the total number of calories he needs to burn: \n\n777,500 calories - Total calories consumed = Calorie deficit \n\nTo find out how much of a calorie deficit Andy needs each day, divide the total calorie deficit by the number of days: \n\nCalorie deficit / Number of days = Daily calorie deficit \n\nDaily calorie deficit = 777,500 calories / 221 days = 3,564 calories/day \n\nSo, Andy needs to burn a net amount of 3,564 calories each day to reach his goal of losing 30 lbs. by his birthday.']","[('First, we need to calculate how many days are between December 31st and July 19th. \n\nTo do this, subtract December 31st from July 19th: \n\nJuly 19th - December 31st = 221 days ', '""Determining the Number of Days for Weight Loss Goal""'), (' Next, we need to multiply the number of days by the number of calories Andy needs to burn per day to lose a pound: \n\n221 days x 3500 calories/day = 777,500 calories ', '""Calculating total calories needed to lose 30 lbs""'), (' Finally, we need to subtract the total number of calories Andy has consumed during these 221 days from the total number of calories he needs to burn: \n\n777,500 calories - Total calories consumed = Calorie deficit \n\nTo find out how much of a calorie deficit Andy needs each day, divide the total calorie deficit by the number of days: \n\nCalorie deficit / Number of days = Daily calorie deficit \n\nDaily calorie deficit = 777,500 calories / 221 days = 3,564 calories/day \n\nSo, Andy needs to burn a net amount of 3,564 calories each day to reach his goal of losing 30 lbs. by his birthday.', '""Calculating total calories needed to lose 30 lbs""')]","[('First, we need to calculate how many days are between December 31st and July 19th. \n\nTo do this, subtract December 31st from July 19th: \n\nJuly 19th - December 31st = 221 days ', 104, 170, 1.0), (' Next, we need to multiply the number of days by the number of calories Andy needs to burn per day to lose a pound: \n\n221 days x 3500 calories/day = 777,500 calories ', 171, 226, 0.9939759036144579), (' Finally, we need to subtract the total number of calories Andy has consumed during these 221 days from the total number of calories he needs to burn: \n\n777,500 calories - Total calories consumed = Calorie deficit \n\nTo find out how much of a calorie deficit Andy needs each day, divide the total calorie deficit by the number of days: \n\nCalorie deficit / Number of days = Daily calorie deficit \n\nDaily calorie deficit = 777,500 calories / 221 days = 3,564 calories/day \n\nSo, Andy needs to burn a net amount of 3,564 calories each day to reach his goal of losing 30 lbs. by his birthday.', 228, 404, 0.9991460290350128)]"
